<?xml version="1.0" encoding="UTF-8" ?>
<?xml-stylesheet type="text/xsl" href="xslt/page.xslt" ?>
<page xmlns:xsd="http://www.w3.org/2001/XMLSchema-instance" xsd:noNamespaceSchemaLocation="./xsd/page.xsd">
    <pageInfo nr="1" lastPage="true" chapter="Start" typ="normal" />
    <left>
        <picture name="Strand und Palmen" file="bild1.png"/>
      <paragraph>
        Die Bahamas (englisch The Bahamas) sind ein Inselstaat  im Nordatlantik und Teil der Westindischen Inseln. Sie liegen südöstlich der USA sowie nordöstlich von Kuba und werden zu Mittelamerika gezählt. Von den mehr als 700 Bahamainseln sind nur 30 bewohnt. Die Inselgruppe erhielt ihren Namen durch die spanischen Eroberer. Sie nannten die Gewässer um die Inseln Baja Mar (spanisch für ‚flaches Meer‘), woraus später Bahamas wurde.
      </paragraph>
    </left>
    <right>
        <paragraph>Lorem ipsum dolor sit amet, consetetur sadipscing elitr, sed diam nonumy eirmod tempor invidunt ut labore et dolore magna aliquyam erat, sed diam voluptua.Lorem ipsum dolor sit amet, consetetur sadipscing elitr, sed diam nonumy eirmod tempor invidunt ut labore et dolore magna aliquyam erat, sed diam voluptua.Lorem ipsum dolor sit amet, consetetur sadipscing elitr, sed diam nonumy eirmod tempor invidunt ut labore et dolore magna aliquyam erat, sed diam voluptua.Lorem ipsum dolor sit amet, consetetur sadipscing elitr, sed diam nonumy eirmod tempor invidunt ut labore et dolore magna aliquyam erat, sed diam voluptua.</paragraph>
        <picture name="Die Flagge der Bahamas" file="flagge.png" />
    </right>
</page>
    
