<?xml version="1.0" encoding="utf-8" ?>
<?xml-stylesheet type="text/xsl" href="xslt/page.xslt" ?>
<page xmlns:xsd="http://www.w3.org/2001/XMLSchema-instance" xsd:noNamespaceSchemaLocation="./xsd/page.xsd">
    <pageInfo nr="1" lastPage="false" chapter="Kultur" typ="normal" />
    <left>
      <picture name="Holzschnitzereien" file="kultur_bild_1_klein.png"/>

      <paragraph headline="Geschichte">
        Mehr als 340'000 Menschen leben in den Bahamas. Mehr als 80% der Bahamesen leben hauptsächlich in städ- tischen Gebieten auf den Hauptinseln New Providence und Grand Bahama. Die Geschichte der Sklaverei in der Karibik ist verant- 
      </paragraph>

       </left>
    <right>
      <picture name="Ein dekorierter Baum" file="kultur_bild_2_klein.png" />

      <paragraph>
        wortlich, dass mehr als 85% der Bevölkerung eine schwarze Hautfarbe haben und 15% sind weißer Hautfarbe.

        Die Hauptsprache ist Englisch.
      </paragraph>
       </right>
</page>
    
