<?xml version="1.0" encoding="utf-8" ?>
<?xml-stylesheet type="text/xsl" href="xslt/page.xslt" ?>
<page xmlns:xsd="http://www.w3.org/2001/XMLSchema-instance" xsd:noNamespaceSchemaLocation="./xsd/page.xsd">
    <pageInfo nr="3" lastPage="true" chapter="Reiseziel" typ="normal" />
    <left>
        <picture name="Hotel Atlantic Bahamas" file="reiseziel_bild_5_klein.jpg"/>
        <paragraph headline="">
          Größe und Dienstleistungsangebot der Hotels sind sehr unterschiedlich. Luxushotels bieten Gepäck-, Pagen- und Zimmerservice, Sport- und Freizeitprogramm, Geschäfte und Swimmingpools; 
        </paragraph>
    </left>
    <right>
        <paragraph>einige haben Privatstrände und Golf- und Tennisplätze. Der Preis für Doppel- und Einzelzimmer ist oft derselbe. In den kleineren Hotels ist die Atmosphäre ungezwungener, es gibt weniger Freizeitanlagen, aber zumeist einen Speisesaal und eine Bar. Neuere Hotels wie das South Ocean Beach Resort auf der Insel New Providence bieten Sportanlagen und Zimmer mit höchstem Komfort. Im Crystal Palace am Cable Beach fehlt es nicht einmal an Kasino, Fitness-Center und Gourmet-Restaurant. In manchen Hotels ist der Bedienungsservice bereits im Preis inbegriffen.</paragraph>
        <picture name="Fischerboot" file="reiseziel_bild_6_klein.jpg" />
    </right>
</page>
    
